{
  "$schema": "../../../schemas/claims.schema.json",
  "schema_version": 1,
  "tool": "aws-cli",
  "legacy_ledger": {
    "source": "../research/tool-page.md",
    "migration_map": "../research/claims-migration.md",
    "expected_origins": [
      "MD1",
      "MD2",
      "MD3",
      "MD4",
      "MD5",
      "MD6",
      "M1",
      "M2",
      "M3",
      "M4",
      "M5",
      "M6",
      "M7",
      "T1",
      "T2",
      "T3",
      "T4",
      "T5",
      "T6",
      "T7",
      "T8",
      "N1",
      "N2",
      "N3",
      "S1",
      "S2",
      "S3",
      "W1",
      "W2",
      "W3",
      "W4",
      "W5",
      "PROSE-1",
      "PROSE-2"
    ]
  },
  "claims": [
    {
      "id": "upstream-repo-is-canonical",
      "statement": "aws-cli's upstream is the canonical AWS-owned repository github.com/aws/aws-cli.",
      "scope": "structure",
      "status": "supported",
      "disposition": "retained",
      "qualification": "Repository identity; the canonical machine-readable record is data/tool.json.",
      "legacy_origins": [
        "MD1"
      ],
      "evidence": [
        {
          "kind": "documentation",
          "url": "https://github.com/aws/aws-cli"
        }
      ]
    },
    {
      "id": "language-is-python",
      "statement": "aws-cli is implemented in Python.",
      "scope": "structure",
      "status": "supported",
      "disposition": "retained",
      "qualification": "The pinned checkout declares requires-python >= 3.9.",
      "legacy_origins": [
        "MD2"
      ],
      "evidence": [
        {
          "kind": "source",
          "subject": "tested-variant",
          "repository": "https://github.com/aws/aws-cli",
          "commit": "12d962d2",
          "path": "pyproject.toml"
        }
      ]
    },
    {
      "id": "license-is-apache-2",
      "statement": "aws-cli is distributed under the Apache-2.0 license.",
      "scope": "structure",
      "status": "supported",
      "disposition": "retained",
      "qualification": "License text is in the pinned checkout.",
      "legacy_origins": [
        "MD3"
      ],
      "evidence": [
        {
          "kind": "source",
          "subject": "tested-variant",
          "repository": "https://github.com/aws/aws-cli",
          "commit": "12d962d2",
          "path": "LICENSE.txt"
        }
      ]
    },
    {
      "id": "tested-version-is-2-36-1",
      "statement": "The smoke image reports aws-cli version 2.36.1 in-container.",
      "scope": "structure",
      "status": "confirmed",
      "disposition": "corrected",
      "qualification": "The inherited page recorded the version as unknown; the receipted in-container self-report is 2.36.1.",
      "legacy_origins": [
        "MD4"
      ],
      "evidence": [
        {
          "kind": "run",
          "receipt": "../receipts/smoke/_build/version-help.md"
        }
      ]
    },
    {
      "id": "tested-commit-is-pinned",
      "statement": "The reviewed source is tag 2.36.1 at commit 12d962d239b9fd0669951c4d27dc366388abba2d.",
      "scope": "structure",
      "status": "supported",
      "disposition": "corrected",
      "qualification": "The commit SHA is recorded in the groundwork report; the version-help receipt records the version string but not the git SHA.",
      "legacy_origins": [
        "MD4"
      ],
      "evidence": [
        {
          "kind": "documentation",
          "path": "../research/report.md"
        }
      ]
    },
    {
      "id": "tier-assignment-is-study-design",
      "statement": "aws-cli is assigned study Tier 1 as a primary comparison baseline.",
      "scope": "operability",
      "status": "unverifiable",
      "disposition": "retained",
      "qualification": "A study-design tier assignment is not a testable property of the tool.",
      "legacy_origins": [
        "MD5"
      ],
      "evidence": [
        {
          "kind": "none",
          "reason": "Tier assignment is a study-design decision, not a testable observation about aws-cli."
        }
      ]
    },
    {
      "id": "runs-unmodified-in-official-image",
      "statement": "aws-cli's testability is trivial: no patch or fork was required to exercise it.",
      "scope": "operability",
      "status": "supported",
      "disposition": "retained",
      "qualification": "Supported by its running unmodified in the official upstream image during groundwork, anonymously and with no self-authored Dockerfile. The receipted run confirms unmodified official-image execution; the testability judgment itself is supported by that observation, not independently confirmed.",
      "legacy_origins": [
        "MD6"
      ],
      "evidence": [
        {
          "kind": "run",
          "receipt": "../receipts/smoke/_build/version-help.md"
        }
      ]
    },
    {
      "id": "both-surfaces-paginate-listobjectsv2",
      "statement": "Both s3 ls and s3api list-objects-v2 list through a paginated ListObjectsV2 continuation-token chain.",
      "scope": "mechanism",
      "status": "supported",
      "disposition": "retained",
      "qualification": "Source establishes both paginator paths; a single --debug probe of one s3api invocation observed the chain. Every-mode verifier PASS proves completeness, not concurrency.",
      "legacy_origins": [
        "M1"
      ],
      "evidence": [
        {
          "kind": "source",
          "subject": "tested-variant",
          "repository": "https://github.com/aws/aws-cli",
          "commit": "12d962d2",
          "path": "awscli/customizations/s3/subcommands.py",
          "lines": "852,917"
        },
        {
          "kind": "source",
          "subject": "tested-variant",
          "repository": "https://github.com/aws/aws-cli",
          "commit": "12d962d2",
          "path": "awscli/clidriver.py",
          "lines": "1105-1107"
        },
        {
          "kind": "observation",
          "artifact": "../receipts/smoke/_capability/debug-hourly.stderr.raw.gz"
        }
      ]
    },
    {
      "id": "serial-single-thread-one-probe",
      "statement": "A --debug probe of one s3api list-objects-v2 invocation issued serial single-MainThread requests, each carrying the prior response's continuation token.",
      "scope": "runtime",
      "status": "supported",
      "disposition": "retained",
      "qualification": "This is one s3api invocation, not an exhaustive per-surface or per-flag sweep.",
      "legacy_origins": [
        "M2"
      ],
      "evidence": [
        {
          "kind": "observation",
          "artifact": "../receipts/smoke/_capability/debug-hourly.stderr.raw.gz"
        }
      ]
    },
    {
      "id": "s3-ls-serial-by-source",
      "statement": "s3 ls consumes its paginator in a synchronous loop with no threads, so it lists serially.",
      "scope": "mechanism",
      "status": "supported",
      "disposition": "retained",
      "qualification": "Source-established; the s3 ls surface was not separately debug-probed.",
      "legacy_origins": [
        "M2"
      ],
      "evidence": [
        {
          "kind": "source",
          "subject": "tested-variant",
          "repository": "https://github.com/aws/aws-cli",
          "commit": "12d962d2",
          "path": "awscli/customizations/s3/subcommands.py",
          "lines": "852,865"
        }
      ]
    },
    {
      "id": "server-caps-page-at-1000",
      "statement": "S3 caps a single listing page at 1,000 keys, the server-side MaxKeys limit.",
      "scope": "mechanism",
      "status": "supported",
      "disposition": "retained",
      "qualification": "The 1,000-key cap is the S3 ListObjectsV2 server limit; --page-size is an upper bound the server will not exceed.",
      "legacy_origins": [
        "M3"
      ],
      "evidence": [
        {
          "kind": "documentation",
          "url": "https://docs.aws.amazon.com/AmazonS3/latest/API/API_ListObjectsV2.html"
        }
      ]
    },
    {
      "id": "probe-observed-three-requests-for-2549-keys",
      "statement": "The --debug probe issued three ListObjectsV2 requests to list a 2,549-key prefix, consistent with the 1,000-key page cap.",
      "scope": "runtime",
      "status": "supported",
      "disposition": "retained",
      "qualification": "One observed probe; the request count ceil(2549/1000)=3 is consistent with the server cap but is not an exhaustive page-size sweep.",
      "legacy_origins": [
        "M3"
      ],
      "evidence": [
        {
          "kind": "observation",
          "artifact": "../receipts/smoke/_capability/debug-hourly.stderr.raw.gz"
        }
      ]
    },
    {
      "id": "no-listing-parallelism",
      "statement": "Neither s3 ls nor s3api has any listing parallelism; the only concurrency in aws-cli is in transfers such as s3 cp and s3 sync.",
      "scope": "mechanism",
      "status": "supported",
      "disposition": "retained",
      "qualification": "Source-primary across both surfaces; the single-thread observation covers one probed s3api invocation, and 'regardless of flags' is a source extrapolation, not an exhaustive smoke.",
      "legacy_origins": [
        "M4",
        "W1",
        "T8"
      ],
      "evidence": [
        {
          "kind": "source",
          "subject": "tested-variant",
          "repository": "https://github.com/aws/aws-cli",
          "commit": "12d962d2",
          "path": "awscli/customizations/s3/subcommands.py",
          "lines": "852-889"
        },
        {
          "kind": "source",
          "subject": "tested-variant",
          "repository": "https://github.com/aws/aws-cli",
          "commit": "12d962d2",
          "path": "awscli/clidriver.py",
          "lines": "1105-1107"
        },
        {
          "kind": "source",
          "subject": "tested-variant",
          "repository": "https://github.com/aws/aws-cli",
          "commit": "12d962d2",
          "path": "awscli/customizations/s3/factory.py"
        },
        {
          "kind": "observation",